"unique_code"|"subject"|"date"|"author_id"|"res_id"|"res_model"|"message_type"|"body"
"4870"|"Oportunidad"|"2021-09-09 00:00:00"|"OdooBot"|"OPPN-04115"|"crm.lead"|"comment"|"Cambio de etapa de 4.MUESTRAS a 7.PRODUCCIÓN  "
"4871"|"Oportunidad"|"2021-10-20 00:00:00"|"Abel Neila"|"OPPN-04115"|"crm.lead"|"comment"|"Es posible ya no necesiten más ud's para este proyecto. "
"4872"|"Oportunidad"|"2021-09-13 00:00:00"|"OdooBot"|"OPPN-04116"|"crm.lead"|"comment"|"Cambio de etapa de 2.PROPUESTA TÉCNICA JUNTO CON OFERTA a 6.PRE-SERIE "
"4873"|"Oportunidad"|"2021-09-24 00:00:00"|"Mayte Fernández"|"OPPN-04116"|"crm.lead"|"comment"|"El proyecto continua, han pedido otra placa para seguir haciendo pruebas
 En Aeropuerto tienen 2 equipos en pruebas "
"4874"|"Oportunidad"|"2021-11-04 00:00:00"|"Mayte Fernández"|"OPPN-04116"|"crm.lead"|"comment"|"con este equipo tienen una oferta de 170 unidades, 
 Pasamos oferta con ligero incremento aun para 170 unidades, 
 El resultado depende de si ganan o no el concurso. Hablo con Eduardo para explicar oferta, y tema de precios , la validez de la oferta es 30 dias. Aconsejo auemnar margen en su licitacion. 
 Comenta que es probable que tarde en salir , es para Rumania .
 Muy contentos con el equipo de recocimiento biometrico, caja de aluminio y los costes son conscientes que se han disparado. 
 "
"4875"|"Oportunidad"|"2021-06-01 00:00:00"|"Antonio Vacas"|"OPPN-04117"|"crm.lead"|"comment"|"Comentarios de la tarea LLAMADA a JUAN CAÑO NAVAS : Contacto con Juan Caño para que me ponga al día del proyecto baliza V16 de la que tenian que decidir si seguian adelante con el nuevo diseño o se quedaban con la actual baliza que no lleva comunicación celular. Gratamente me confirma que siguen con el proyecto y de hecho ha empezado a diseñar la PCB con el BC65 y L70LB. A partir de aqui el cliente va a necesitar ayuda para el diseño de las antenas, sobre todo para la de NB-IoT, ya que para la del GPS esta considerando usar la SR4G008 de Antenova. El siguiente paso es que el cliente nos pase planos 3D de la envolvente para tener una call con Quectel, Anna, Fran y yo. "
"4876"|"Oportunidad"|"2021-06-16 00:00:00"|"OdooBot"|"OPPN-04117"|"crm.lead"|"comment"|"Cambio de etapa de 2.PROPUESTA TÉCNICA JUNTO CON OFERTA a 4.MUESTRAS "
"4877"|"Oportunidad"|"2021-06-16 00:00:00"|"Antonio Vacas"|"OPPN-04117"|"crm.lead"|"comment"|"Comentarios de la tarea VIDEOVISITA ASOC a JUAN CAÑO NAVAS : Reunidos por Team de parte del cliente: Juan Caño y Carlos Medina, d eparte de Quectel: David Baró y Jose Adarve, de parte de Monolitic: Francisco Sanchez, Anna Teotino y antonio Vacas. Primera toma de contacto seria con el cliente donde se han debatidos varios temas, módulos adecuados para el producto(BC65 y L76L) y antenas. En las antenas seguramente paguen el desarrollo para las bandas NB y la del GSNN será la SR4G008 de Antenova. El cliente se ha comprometido a enviar los archivos de manera que Quectel pueda manipularlos para poder orientar en el diseño. Monoloitic se compromete a enviar lo antes posible muestras y kit de desarrollos de los modulos definidos. "
"4878"|"Oportunidad"|"2021-07-02 00:00:00"|"Antonio Vacas"|"OPPN-04117"|"crm.lead"|"comment"|"Comentarios de la tarea LLAMADA a JUAN CAÑO NAVAS : Llamada de seguimiento a Juan Caño para que intente pasarnos lo antes posible los archivos convertidos en Altium para que Quectel pueda revisar el esquematico y el layout del equipo. Resulta que han tenido un stand en el Mobile World y han estado muy liados, se compromete a tenerlo en la próxima semana(5-9 de julio). Le confirmo que la semana que viene le entregamos los kit de evaluación y las muestras para el diseño. "
"4879"|"Oportunidad"|"2021-10-28 00:00:00"|"OdooBot"|"OPPN-04117"|"crm.lead"|"comment"|" "
"4880"|"Oportunidad"|"2021-09-10 00:00:00"|"Renato Vila"|"OPPN-04118"|"crm.lead"|"comment"|"Comentarios de la tarea LLAMADA : Me dice que a su cliente el proyecto todavía no les ha salido, ni se lo hanrechazado. Habrá que seguir esperando. "
"4881"|"Oportunidad"|"2021-10-08 00:00:00"|"José Luis Trillo"|"OPPN-04119"|"crm.lead"|"comment"|"los módulos van a seguir de pruebas hasta enero o febrero del 2022
 "
"4882"|"Oportunidad"|"2021-12-01 00:00:00"|"José Luis Trillo"|"OPPN-04119"|"crm.lead"|"comment"|"Comentarios de la tarea LLAMADA : Me comenta que los módulos de Quectel siguen en pruebas y que hasta febrero-marzo no me puede decir nada. "
"4883"|"Oportunidad"|"2021-06-25 00:00:00"|"Mayte Fernández"|"OPPN-04121"|"crm.lead"|"comment"|"Proponemos posibilidad de menor cantidad 500 unidades a precio mayor. 
 tampoco le encaja oferta, consigue alternativas con coste menor y sin necesidad de comprar 500. 
 Cerramos OPPN "
"4884"|"Oportunidad"|"2021-06-25 00:00:00"|"Mayte Fernández"|"OPPN-04121"|"crm.lead"|"notification"|"Se ha cambiado el estado de esta OppN de EN CURSO a PERDIDA "
"4885"|"Oportunidad"|"2021-06-30 00:00:00"|"Carles García"|"OPPN-04121"|"crm.lead"|"comment"|"el cliente implementa para mantenimiento una solucion radicalente diferente a que nos compraba y que es obsoleta. "
"4886"|"Oportunidad"|"2021-06-30 00:00:00"|"Abel Neila"|"OPPN-04122"|"crm.lead"|"comment"|"De momento, sin novedades. "
"4887"|"Oportunidad"|"2021-09-27 00:00:00"|"Abel Neila"|"OPPN-04122"|"crm.lead"|"comment"|"Me indica el cliente que sin novedades. "
"4888"|"Oportunidad"|"2021-12-01 00:00:00"|"Jorge Cuadra"|"OPPN-04123"|"crm.lead"|"notification"|"Se ha cambiado el estado de esta OppN de EN CURSO a PERDIDA "
"4889"|"Oportunidad"|"2021-06-23 00:00:00"|"Xavier Andiñach"|"OPPN-04124"|"crm.lead"|"comment"|"AUN EN FASE DE EGOCIACIÓN CON SU CLIENTE. NO CREE QUE SEPAN ALGO HASTA SETIEMBRE POR LO MENOS. "
"4890"|"Oportunidad"|"2021-07-05 00:00:00"|"Antonio Vacas"|"OPPN-04125"|"crm.lead"|"notification"|"Se ha cambiado el estado de esta OppN de EN CURSO a PERDIDA "
"4891"|"Oportunidad"|"2021-07-07 00:00:00"|"Antonio Vacas"|"OPPN-04125"|"crm.lead"|"comment"|"Comentarios de la tarea LLAMADA a NOELIA SALINAS ALAMO : Me contacta Noelia para ver si ya tenemos stock de este PC panel que les oferte en abril, despues de hacer la con sulta con Faytech nos confirman que aún no han recibido unidades y que el plazo que nos dieron para julio se les va retrasar al menos un mes mas. Ya le he pasado la información al cliente, quedo a la espera de respuesta. "
"4892"|"Oportunidad"|"2021-07-16 00:00:00"|"Xavier Andiñach"|"OPPN-04126"|"crm.lead"|"comment"|"LA PASO A STAND BY YA QUE DE MOMENTO ESTO NO SE VA A REVISAR. "
"4893"|"Oportunidad"|"2021-07-16 00:00:00"|"Xavier Andiñach"|"OPPN-04126"|"crm.lead"|"notification"|"Se ha cambiado el estado de esta OppN de EN CURSO a STAND BY "
"4894"|"Oportunidad"|"2021-06-08 00:00:00"|"OdooBot"|"OPPN-04127"|"crm.lead"|"comment"|"Cambio de etapa de 2.PROPUESTA TÉCNICA JUNTO CON OFERTA a 7.PRODUCCIÓN "
"4895"|"Oportunidad"|"2021-06-10 00:00:00"|"OdooBot"|"OPPN-04128"|"crm.lead"|"comment"|"Cambio de etapa de 6.PRE-SERIE a 7.PRODUCCIÓN "
"4896"|"Oportunidad"|"2021-10-20 00:00:00"|"Abel Neila"|"OPPN-04128"|"crm.lead"|"comment"|"Me indica que es posible que no compren tantas ud's como estaban previsto ya que no es la máquina que estén vendiendo.
 "
"4897"|"Oportunidad"|"2021-09-14 00:00:00"|"Antonio Vacas"|"OPPN-04129"|"crm.lead"|"comment"|"Muestras homologadas a la espera de que le salgan compras de este dispositivo. "
"4898"|"Oportunidad"|"2021-09-08 00:00:00"|"Diego Martín"|"OPPN-04130"|"crm.lead"|"comment"|"PROYECTO: Monitor 7"" PCAP - 2021-008
 Contacto: Adoracion Soria
 Iker Rodriguez ya no trabaja en KAPSCH
 -La oferta sigue en  curso.
 -Eviamos oferta actualizada  de Litemax ya que Litemax ha actualizado las referencias:
 ref.: UPD0705-TIT-Q11  (1000 nits)
 ref.: UPD0703-TTB-Q11 (600 nits)
 
 "
"4899"|"Oportunidad"|"2021-09-08 00:00:00"|"OdooBot"|"OPPN-04130"|"crm.lead"|"comment"|"Cambio de etapa de 2.PROPUESTA TÉCNICA JUNTO CON OFERTA a 3.ESTUDIO POR PARTE DE "
"4900"|"Oportunidad"|"2021-09-10 00:00:00"|"Renato Vila"|"OPPN-04131"|"crm.lead"|"comment"|"Está fabricando las primeras 200 unds. "
"4901"|"Oportunidad"|"2021-10-19 00:00:00"|"Renato Vila"|"OPPN-04131"|"crm.lead"|"comment"|"Re ofertar porque compra igual o mas barato en Mouser. "
"4902"|"Oportunidad"|"2021-11-30 00:00:00"|"Renato Vila"|"OPPN-04131"|"crm.lead"|"notification"|"Se ha cambiado el estado de esta OppN de EN CURSO a PERDIDA "
"4903"|"Oportunidad"|"2021-06-18 00:00:00"|"Xavier Andiñach"|"OPPN-04133"|"crm.lead"|"comment"|"Comentarios de la tarea LLAMADA : PARECE QUE POCO A POCO VAN COGIENDO EL RITMO Y POCO A POCO VAN GASTANDO EL STOCKDE DISPLAYS QUE TIENEN.EL NUEVO DISPLAY DE 5"" DGUS II PARECE QUE LO HAN PUESTO EN MARCHA ENSEGUIDA Y VAVIENTO EN POPA. ME PIDE QUE LE PASE OFERTA PARA 300 UNIDADES, SERÍA PARAENTREGAR A FINALES DE AÑO/PRINCIPIOS DEL QUE VIENE. "
"4904"|"Oportunidad"|"2021-06-18 00:00:00"|"OdooBot"|"OPPN-04133"|"crm.lead"|"comment"|"Cambio de etapa de 2.PROPUESTA TÉCNICA JUNTO CON OFERTA a 5.OFERTA Y NEGOCIACIÓN "
"4905"|"Oportunidad"|"2021-06-30 00:00:00"|"Xavier Andiñach"|"OPPN-04133"|"crm.lead"|"comment"|"Comentarios de la tarea LLAMADA : RESIGO LA OFERTA DEL DISPLAY NUEVO. LO TIENE PRESENTE Y EN BREVE SE PONE A ELLO,DEJEMOSLE UN PAR O TRES DE DIAS "
"4906"|"Oportunidad"|"2021-07-06 00:00:00"|"OdooBot"|"OPPN-04133"|"crm.lead"|"comment"|"Cambio de etapa de 5.OFERTA Y NEGOCIACIÓN a 7.PRODUCCIÓN "
"4907"|"Oportunidad"|"2021-07-08 00:00:00"|"Xavier Andiñach"|"OPPN-04133"|"crm.lead"|"comment"|"Comentarios de la tarea LLAMADA : LE LLAMO PARA CONFIRMAR SI JUMPER ON ( CON SUBIDA DE PRECIO ) O JUMPER OFF. MEDICE QUE EL LUES ME LO CONFIRMA "
"4908"|"Oportunidad"|"2021-08-31 00:00:00"|"Xavier Andiñach"|"OPPN-04133"|"crm.lead"|"comment"|"Comentarios de la tarea LLAMADA : LE LLAMO PARA AVISAR QUE HEMOS MADADO MUESTRA DEL DISPLAY CO EL JUMPER ON Y QUEPOR FAVOR LO REVISE Y HOMOLOGUE PARA DESENCALLAR EL PEDIDO "
"4909"|"Oportunidad"|"2021-09-07 00:00:00"|"Xavier Andiñach"|"OPPN-04133"|"crm.lead"|"comment"|"Comentarios de la tarea LLAMADA : RECIBIDA LA MUESTRA CON EL JUMPER ON, QUEDAMOS EN QUE LA PRUEBE Y VALIDE Y ASÍYO DESBLOQUEAR EL PEDIDO. "
"4910"|"Oportunidad"|"2021-09-20 00:00:00"|"Renato Vila"|"OPPN-04134"|"crm.lead"|"comment"|"Estamos a la espera de que WISOl saque un módulo para ofrecer a Hidroconta. "
"4911"|"Oportunidad"|"2021-09-20 00:00:00"|"Renato Vila"|"OPPN-04134"|"crm.lead"|"notification"|"Se ha cambiado el estado de esta OppN de EN CURSO a STAND BY "
"4912"|"Oportunidad"|"2021-10-14 00:00:00"|"Renato Vila"|"OPPN-04134"|"crm.lead"|"comment"|"Anna Teotino: Lamentablemente IQRF es bastante más caro, lo dejamos por el momen to.
 
 "
"4913"|"Oportunidad"|"2021-06-01 00:00:00"|"Renato Vila"|"OPPN-04135"|"crm.lead"|"comment"|"Comentarios de la tarea LLAMADA : Me dice que ha pasado la oferta de WISOL a su compañero Iván, este me puede darfeedback de la misma. En cuanto al proyecto en Mexico y los modulos de Wisol, cuandollegue el momento volverán a pedir precios/plazos, todavía no han llegado allí. "
"4914"|"Oportunidad"|"2021-07-20 00:00:00"|"Renato Vila"|"OPPN-04135"|"crm.lead"|"comment"|"En principio nos les encaja el plazo, tendrán una reunión para decidir donde pasar la compra. "
"4915"|"Oportunidad"|"2021-07-20 00:00:00"|"OdooBot"|"OPPN-04135"|"crm.lead"|"comment"|"Cambio de etapa de 1.IDENTIFICACIÓN O.N. a 2.PROPUESTA TÉCNICA JUNTO CON OFERTA "
"4916"|"Oportunidad"|"2021-10-04 00:00:00"|"Renato Vila"|"OPPN-04135"|"crm.lead"|"notification"|"Se ha cambiado el estado de esta OppN de EN CURSO a STAND BY "
"4917"|"Oportunidad"|"2021-10-04 00:00:00"|"Renato Vila"|"OPPN-04135"|"crm.lead"|"comment"|"La persona de compras me pasa feedback de ningún tipo, y venga que he insistido. "
"4918"|"Oportunidad"|"2021-07-16 00:00:00"|"Diego Martín"|"OPPN-04136"|"crm.lead"|"comment"|"
 PROYECTO: MONITOR 29,3"" PARA SEÑALIZACION INTERIOR DE AUTOBUS
 Contacto: Jose Luis Pizarro
 El proyecto es para cambiar  140 autobuses de la flota de Bilbobus.
 De estos solo quedan por cambiar  34 pcs y son las que les quedarían por  pedir.
 
 Actualmente  no saben si esta cambio en la flota  se hará este 2021  o  ya en 2022   
 La ref. de Litemax está validada.
 El precio  de INELMATIC son  de 800°  aprox.  
 
 Etra Norte tb está trabajando con la Diputación para  meter  el mismo  monitor en las marquesinas (esto va para más largo plazo)
 Es una mera cuestión de precio. "
"4919"|"Oportunidad"|"2021-06-04 00:00:00"|"Daniel Rueda"|"OPPN-04137"|"crm.lead"|"comment"|"Hablo con Josep para confirmar si han recibido las 2 unidades de la pantalla de 4,3"" que pidieron. Me confirma que si y que las quieren probar cuanto antes. "
"4920"|"Oportunidad"|"2021-06-15 00:00:00"|"Daniel Rueda"|"OPPN-04137"|"crm.lead"|"comment"|"Hablo con Josep ya que me comenta que el grosor del datasheet de la pantalla de4,3"" que le hicimos llegar (4,95mm) para probar, no coincide con lo que le hallegado (6mm). Tras comentarlo con Aina, me comenta que en el touch en vez deser de 0,7mm es de 2mm. Pero que la sensibilidad está ajustada a 2mm para quefuncione el COVER forntal que le ponen ellos. Me comenta que seguramente laprimera semana de julio ya habrá podido probar la pantalla, ya que esta semanahace el diseño del layout, la semana que viene se fabrican las PCBs y a partirde ahí ya pueden hacer las pruebas para darme feedback. "
"4921"|"Oportunidad"|"2021-07-26 00:00:00"|"Daniel Rueda"|"OPPN-04137"|"crm.lead"|"comment"|"Hablo con Josep por la pantalla de 4,3"" para ver si la habían probado. Mecomenta que la semana pasada recibió la PCB montada con la pantalla incluso.Pero que no ha podido probarla ya que la persona que se encarga de poner lapantalla en marcha hasta el día 9 de agosto no vuelve de vacaciones y él se vaese mismo día de vacaciones hasta el 30 de agosto. Así que hasta esa fecha,principios de septiembre no tendremos feedback de si todo esta bien, me comentaque no debería de haber problema ya que es RGB y tal y que vista la pantallamontada sin ponerse en marcha tiene muy buena pinta, así que todo estará bien. "
"4922"|"Oportunidad"|"2021-09-07 00:00:00"|"Daniel Rueda"|"OPPN-04137"|"crm.lead"|"comment"|"Hablo con Josep, el cual me comenta que está teniendo problemas para iniciar eltouch de la pantalla de 4,3"" que le hicimos llegar para que pudiera homologarla.Se lo traslado a Rubén para que lo trabaje con Multi-inno. Le comento que enbreve le haremos llegar respuesta para ayudarlo. "
"4923"|"Oportunidad"|"2021-09-29 00:00:00"|"Daniel Rueda"|"OPPN-04137"|"crm.lead"|"comment"|"Hablo con Josep para ver si recibió mi correo con los Firmwares para las pantallas de 4,3"" y me confirma que si, que los ha descargado pero que todavíano ha podido probarlo. Me comenta que espera poder hacerlo durante la semana que viene. "
"4924"|"Oportunidad"|"2021-09-29 00:00:00"|"OdooBot"|"OPPN-04137"|"crm.lead"|"comment"|"Cambio de etapa de 2.PROPUESTA TÉCNICA JUNTO CON OFERTA a 4.MUESTRAS "
"4925"|"Oportunidad"|"2021-10-27 00:00:00"|"Daniel Rueda"|"OPPN-04137"|"crm.lead"|"comment"|"Hablo con Josep ya que me comenta que la pantalla que pidieron de 4,3"" deMulti-inno era con un ajuste de 2mm de sensibilidad para poner un coverglass encima, pero el fabricante no lo envió así. Y ahora tienen que dedicarle un tiempo que no tienen para ajustar el firmware (el fabricante nos ha enviado ladocumentación necesaria para hacerlo). Por lo que la mejor opción es devolverle las muestras al fabricante y que nos las devuelva con la sensibilidad ajustada a 2mm. Hay que confirmarlo con Aina para verificar que podamos hacerlo y tirarlo hacia adelante. "
"4926"|"Oportunidad"|"2021-11-25 00:00:00"|"Daniel Rueda"|"OPPN-04137"|"crm.lead"|"comment"|"Se le enviaron al fabricante las 2 unidades para que nos las hagan llegar con el touch ajustado a la sensibilidad de 2mm para que el cliente ponga su frontal y pueda probarla y homologarla. "
"4927"|"Oportunidad"|"2021-10-05 00:00:00"|"Jorge Cuadra"|"OPPN-04138"|"crm.lead"|"comment"|"Han recibido las 100 unidades, pero todavía no hemos empezado a montar la preserie
 En cuanto la monten, nos informaran.
 "
"4928"|"Oportunidad"|"2021-10-05 00:00:00"|"OdooBot"|"OPPN-04138"|"crm.lead"|"comment"|"Cambio de etapa de 2.PROPUESTA TÉCNICA JUNTO CON OFERTA a 6.PRE-SERIE "
"4929"|"Oportunidad"|"2021-06-16 00:00:00"|"Jorge Cuadra"|"OPPN-04139"|"crm.lead"|"comment"|"Comentarios de la tarea LLAMADA : Han probado las TFT estándar, les encajan como solución. Me pregunta los pasos aseguir para hacer el tooling. También me facilita un PDF con las cotas criticasa modificar para que las TFt sean compatib les. "
"4930"|"Oportunidad"|"2021-06-22 00:00:00"|"Jorge Cuadra"|"OPPN-04139"|"crm.lead"|"comment"|"Comentarios de la tarea LLAMADA : Explico como proceder con el tooling, planos y ref definitiva. "
"4931"|"Oportunidad"|"2021-07-07 00:00:00"|"Jorge Cuadra"|"OPPN-04139"|"crm.lead"|"comment"|"Comentarios de la tarea LLAMADA : Llamo a Mikel para ver como han gestionado el envío de la muestra de powertippara enviar a Multiinno, me dice que finalmente lo enviaron ellos.Le recuerdo que me tiene que para el pedido para poner en marcha el proyecto. "
"4932"|"Oportunidad"|"2021-12-01 00:00:00"|"OdooBot"|"OPPN-04139"|"crm.lead"|"comment"|"Cambio de etapa de 1.IDENTIFICACIÓN O.N. a 4.MUESTRAS "
"4933"|"Oportunidad"|"2021-06-04 00:00:00"|"OdooBot"|"OPPN-04142"|"crm.lead"|"comment"|"Cambio de etapa de 6.PRE-SERIE a 7.PRODUCCIÓN "
"4934"|"Oportunidad"|"2021-07-08 00:00:00"|"Jorge Cuadra"|"OPPN-04142"|"crm.lead"|"comment"|"Comentarios de la tarea LLAMADA : Comento a Patricia que a día de hoy no disponemos de fecha de entrega de losdisplays debido a que el proveedor de IC no da fechas a Wisechip. Le comento quela situación no tiene pinta de mejorar cara al próximo año, por lo que sidispone de previsiones seria interesante lanzar pedidos con el fin de garantizar entregas. "
"4935"|"Oportunidad"|"2021-06-08 00:00:00"|"Iván Ruiz"|"OPPN-04143"|"crm.lead"|"comment"|"Comentarios de la tarea LLAMADA : Ya les han llegado las muestras, les ha sorprendido muchísimo la agilidad.Las quieren comparar con el equipo demo que les dejé (y con el que estánencantados a nivel de luminosidad y respuesta del táctil) para ver si hay muchadiferencia entre los 1.000 nits del equipo demo y los 850 de las muestras. Loharán la semana que viene porque ahora están de entregas.Les ha gustado mucho también el precio y me pregunta si se mantendrá.Le digo que en principio, para la preserie de 10, sí; aunque hay que entender elpanorama actual y la volatilidad de los precios. "
"4936"|"Oportunidad"|"2021-06-18 00:00:00"|"Daniel Rueda"|"OPPN-04147"|"crm.lead"|"comment"|"Hablo con Javier para preguntarle si recibió las muestras tanto de 1,77"" comolas de 5,2"". Me confirma que las recibió y que de la de 5,2"" ha empezado amirarselo y que parece que esta todo ok y que tiene muy buena pinta. Me comentaque tampoco tienen mucha prisa ya que ahora es una punta de faena alta y que sepondrán con los nuevos diseños después de verano. La de 1,77"" va para un nuevoproducto que irá en un carril DIN, el cual tampoco moverán muchas cantidades. "
"4937"|"Oportunidad"|"2021-09-07 00:00:00"|"OdooBot"|"OPPN-04147"|"crm.lead"|"comment"|"Cambio de etapa de 3.ESTUDIO POR PARTE DEL CLIENTE a 4.MUESTRAS "
"4938"|"Oportunidad"|"2021-09-07 00:00:00"|"Daniel Rueda"|"OPPN-04147"|"crm.lead"|"comment"|"Hablamos de las pantallas, me comenta que le coincidió con las vacaciones y no pudo probarlas, aunque si que es cierto que no la tienen como prioridad, pero está buscando un hueco para probarlas y ver como van. "
"4939"|"Oportunidad"|"2021-11-25 00:00:00"|"Daniel Rueda"|"OPPN-04147"|"crm.lead"|"notification"|"Se ha cambiado el estado de esta OppN de EN CURSO a STAND BY "
"4940"|"Oportunidad"|"2021-06-03 00:00:00"|"Diego Martín"|"OPPN-04148"|"crm.lead"|"comment"|"
 PROYECTO: TIRA LED LATERAL IP67  RGB
 Contacto: María Razquin
 Les han adelantado la fabricación  de los protos de Septiembre a Julio.
 Necesita  6-8 pcs para Julio de la tira RGB.
 
 1.- Respecto  al  tema de la temperatura, resolveremos a  posteriori, ahora para los protos tirarán con lo que tengamos,  pero me adelanta que  40ºC será difícil que acepten en  futuro y ello les obligue a cambiar si no  aseguramos esos 50ºC.
 2.- Dimensión tira:  
 La dimensión de la tira  NO PUEDE SOBREPASAR  LOS 470mm, este es el máximo total que pueden aceptar incluyendo los capuchones. 
 A partir  de ahí  previendo que el  capuchón  era de 5-10mm
 INGETEAM  redujo  la longitud  total a 460mm  (460mm + 10mm  = 470mm)
 
 En cualquier  caso que sea el fabricante  que haga el corte para que la distancia  total  sea lo  más  próxima a 470mm
 -El resto de especificaciones es ok. "
"4941"|"Oportunidad"|"2021-06-03 00:00:00"|"OdooBot"|"OPPN-04148"|"crm.lead"|"comment"|"Cambio de etapa de 2.PROPUESTA TÉCNICA JUNTO CON OFERTA a 3.ESTUDIO POR PARTE DE "
"4942"|"Oportunidad"|"2021-09-30 00:00:00"|"OdooBot"|"OPPN-04148"|"crm.lead"|"comment"|"Cambio de etapa de 3.ESTUDIO POR PARTE DEL CLIENTE a 7.PRODUCCIÓN "
"4943"|"Oportunidad"|"2021-09-11 00:00:00"|"Xavier Andiñach"|"OPPN-04149"|"crm.lead"|"notification"|"Se ha cambiado el estado de esta OppN de EN CURSO a PERDIDA "
"4944"|"Oportunidad"|"2021-09-11 00:00:00"|"Xavier Andiñach"|"OPPN-04149"|"crm.lead"|"comment"|"INFORMACIÓN ADICIONAL PÉRDIDA : EL CLIENTE QUERIA ALGO MUCHO MÁS BARATO QUE LA C OMPETENCIA ( TEMPEL ) Y AL IR EN LÍNEA NOS DESCARTARON "
"4945"|"Oportunidad"|"2021-09-09 00:00:00"|"Iván Ruiz"|"OPPN-04150"|"crm.lead"|"notification"|"Se ha cambiado el estado de esta OppN de EN CURSO a PERDIDA "
"4946"|"Oportunidad"|"2021-06-01 00:00:00"|"Xavier Andiñach"|"OPPN-04151"|"crm.lead"|"comment"|"Comentarios de la tarea LLAMADA : LE AVISO QUE LAS MUESTRAS DEL ESP32-WROVER-E VAN A LLEGAR EN AGOSTO. ME DICE QUEVA  AHABLAR INTERNAMENTE A VER QUÉ HACEN Y QUE POR FAVOR LE ENVIE UN MAIL.LE DOY COMO POSIBLES ALTERNATIVAS QUE NOS INDIQUEN EL FW Y SDK DE LAS MUESTRASQUE CONSIGUIERON PARA INTENTAR ENTREGAR LO MISMO DESDE ESPRESSIF.LO HAN DE HABLAR. "
"4947"|"Oportunidad"|"2021-06-02 00:00:00"|"Xavier Andiñach"|"OPPN-04151"|"crm.lead"|"comment"|"Comentarios de la tarea LLAMADA : COMENTAMOS EL TEMA DEL PEDIDO, MUESTRAS...NO ME SABE O QUIERE DECIR DE DONDE HAN SACADO LA MUESTRA, MÁS QUE LA HAN SACADOVIA WEB.AL NO PODER ESPERAR A LAS MUESTRAS ME PASAN PEDIDO YA, 83K°, LO EMPIEZO A MOVERCON JUAN CARLOS Y FRAN. "
"4948"|"Oportunidad"|"2021-06-07 00:00:00"|"Xavier Andiñach"|"OPPN-04151"|"crm.lead"|"comment"|"Comentarios de la tarea LLAMADA : ME INDICA QUE HA MONTADO YA LOS PROTOS CON LA PILA DE BOTÓN.ME INDICA QUE LOS ESP32-WROVER-E RRALMENTE LE DA IGUAL LA VERSIÓN DE AT COMMANDSQUE MONTE PORQUE ELLOS TIENEN UNA IMAGEN DE LO QUE VAN A INSTALAR, CUANDORECIBEN EL MÓDULO LO BORRAN Y CARGAN ESA IMAGEN. DE HECHO ME PREGUNTA SI SERÍAPOSIBLE RECIBIR LOS MÓDULOS SIN EL AT COMMAND GRABADO. "
"4949"|"Oportunidad"|"2021-06-07 00:00:00"|"OdooBot"|"OPPN-04151"|"crm.lead"|"comment"|"Cambio de etapa de 2.PROPUESTA TÉCNICA JUNTO CON OFERTA a 4.MUESTRAS "
"4950"|"Oportunidad"|"2021-09-10 00:00:00"|"OdooBot"|"OPPN-04151"|"crm.lead"|"comment"|"Cambio de etapa de 4.MUESTRAS a 6.PRE-SERIE  Cambio de etapa de 6.PRE-SERIE a 7.PRODUCCIÓN "
"4951"|"Oportunidad"|"2021-09-27 00:00:00"|"Xavier Andiñach"|"OPPN-04151"|"crm.lead"|"comment"|"Comentarios de la tarea LLAMADA : RECLAMO QUE MODIFIQUE EL PEDIDO DE LAS PILASHASTA 12K O 9K POR TEMA DE EMBALAJE.LE DAN EL OK A 12K. ME LO PASA LUEGO POR MAIL. "
"4952"|"Oportunidad"|"2021-10-21 00:00:00"|"Xavier Andiñach"|"OPPN-04151"|"crm.lead"|"comment"|"Comentarios de la tarea LLAMADA : ME LLAMA DE NUEVO ITERESÁNDOSE EN SI SE PUEDE AVANZAR EL PLAZO DE LAS PILAS DESEIKO, LE DIGO QUE NO Y ME PIDE QUE INSISTA... "
"4953"|"Oportunidad"|"2021-06-15 00:00:00"|"Daniel Rueda"|"OPPN-04152"|"crm.lead"|"comment"|"Hablo con Carmen, ya que me preguntaba por el plazo de entrega de las 500unidades que necesitaban para este mes de junio. Le comento que aún nodisponemos de fecha de confirmación, que a ver si en un par de días nosconfirman alguna cosa (Fran ha hablado con Baró para ver si se puede haceralgo). Si no las 500 unidades rápidas, algún parcial por ejemplo... Le preguntopor las previsiones y me comenta que no puede decirme mucho, ya que estánesperando estas primeras 500 unidades. Le comento que es bastante urgente elconocer esa previsión por los plazos de entrega, por lo que por favor, trabajenen ello porque ya está viendo que no hay ni confirmaciones de plazo de e ntrega. "
"4954"|"Oportunidad"|"2021-06-21 00:00:00"|"Daniel Rueda"|"OPPN-04152"|"crm.lead"|"comment"|"Hablo con Carmen para confirmarle que de las 500 unidades del BG96 que aún noestaban confirmadas, hemos conseguido que urgentemente nos envíen 250 unidadesdada la aplicación a la que van destinados. Pero las 250 unidades restantes notenemos confirmación aún. Me comenta que necesita cotización para 5.000 unidadesya que quieren consumirlas a lo largo del 2021 y el primer quarter del 2022. Enteoría, Montronic me tenía que haber hecho llegar una solicitud de cotización.Cosa que aún no me han hecho llegar y eso no es bueno para nosotros y tampocopara Groenlandia, por lo que Carmen me comenta que por favor pida dichacotización y hablará con Montronic. El miércoles me llamará Carmen para darmeinformación con respecto a la call que tiene con Montronic mañana. "
