"unique_code"|"subject"|"date"|"author_id"|"res_id"|"res_model"|"message_type"|"body"
"1037"|"SLeadsCom"|"2021-06-15 00:00:00"|"Carmen González"|"SL014957"|"crm.lead"|"comment"|"Le digo que no tenemos en stock y hay una cantidad mínima de venta "
"1038"|"SLeadsCom"|"2021-06-14 00:00:00"|"Antonio Vacas"|"SL014958"|"crm.lead"|"comment"|"Pasan de trabajar con empresas catalanas. "
"1039"|"SLeadsCom"|"2021-06-15 00:00:00"|"Carmen González"|"SL014959"|"crm.lead"|"comment"|"Llamada telefónica "
"1040"|"SLeadsCom"|"2021-06-22 00:00:00"|"Carmen González"|"SL014960"|"crm.lead"|"comment"|"Llamada telefónica "
"1041"|"SLeadsCom"|"2021-06-16 00:00:00"|"Carmen González"|"SL014961"|"crm.lead"|"comment"|"Llamada telefónica "
"1042"|"SLeadsCom"|"2021-07-01 00:00:00"|"José Luis Trillo"|"SL014962"|"crm.lead"|"comment"|"Hablo con ellos y me comentan que buscan una solución lorawan para su sistema de containers en edificios. Ofrezco controlador y gateway de milesight. También hablamos de equipos industriales porque me comenta que a veces utilizan plcs pero en algunos aplicativos le piden pc embeded que hagan tanto de plc como de equipo "
"1043"|"SLeadsCom"|"2021-07-06 00:00:00"|"José Luis Trillo"|"SL014962"|"crm.lead"|"comment"|"Me comentan que lo valoran, pero que por ahora no tienen un proyecto donde implementar nuestras soluciones. Cuando les salga algo, nos comentan "
"1044"|"SLeadsCom"|"2021-06-16 00:00:00"|"Carmen González"|"SL014964"|"crm.lead"|"comment"|"FABRICAN EN ESPAÑA LAS TFT'S LAS IMPORTAN PERO ME DICE QUE ENVÍE INFORMACION Y ELLA LA PASARA A INGENIERIA. Enviado correo con catálogo de Visualización y módulos comunicacion "
"1045"|"SLeadsCom"|"2021-06-22 00:00:00"|"José Luis Trillo"|"SL014965"|"crm.lead"|"comment"|"Se gestiona en el SL014968 "
"1046"|"SLeadsCom"|"2021-06-21 00:00:00"|"Carmen González"|"SL014966"|"crm.lead"|"comment"|"ES UNA METALURGICA. LE PREGUNTO SI ESTAN TRABAJANDO EN UN PROYECTO, ME DICE QUE SI PERO QUE NO ME PUEDE DAR MAS DATOS "
"1047"|"SLeadsCom"|"2021-06-22 00:00:00"|"José Luis Trillo"|"SL014967"|"crm.lead"|"comment"|"Gestionado antes de recibir este sales lead, por carlos y por mi. "
"1048"|"SLeadsCom"|"2021-07-01 00:00:00"|"José Luis Trillo"|"SL014968"|"crm.lead"|"comment"|"He llamado un par de veces y me salta el buzon de voz ha diseñado una maquina que necesita controlar a distancia no tiene web server, de hecho, me pregunta que es Le paso info del crd y del combo "
"1049"|"SLeadsCom"|"2021-07-07 00:00:00"|"José Luis Trillo"|"SL014968"|"crm.lead"|"comment"|"Comenta que no tiene tiempo de mirarselo y que se lo mirará despues de verano. "
"1050"|"SLeadsCom"|"2021-06-21 00:00:00"|"Carmen González"|"SL014970"|"crm.lead"|"comment"|"PREGUNTADO A WINMATE "
"1051"|"SLeadsCom"|"2021-07-20 00:00:00"|"Carmen González"|"SL014970"|"crm.lead"|"comment"|"SIN RESPUESTA. CIERRO SALES SIN OPORTUNIDAD "
"1052"|"SLeadsCom"|"2021-06-29 00:00:00"|"Iván Ruiz"|"SL014972"|"crm.lead"|"comment"|"  "
"1053"|"SLeadsCom"|"2021-06-23 00:00:00"|"Carmen González"|"SL014973"|"crm.lead"|"comment"|"Ya contacte en su día y de momento nada. "
"1054"|"SLeadsCom"|"2021-08-26 00:00:00"|"Iván Ruiz"|"SL014975"|"crm.lead"|"comment"|"Hablo con Jose Luis y está de vacaciones, "
"1055"|"SLeadsCom"|"2021-09-02 00:00:00"|"Iván Ruiz"|"SL014975"|"crm.lead"|"comment"|"se incorpora la semana del 30 de Agosto "
"1056"|"SLeadsCom"|"2021-08-26 00:00:00"|"Iván Ruiz"|"SL014975"|"crm.lead"|"comment"|"Quedo en llamar la semana que viene "
"1057"|"SLeadsCom"|"2021-09-02 00:00:00"|"Iván Ruiz"|"SL014975"|"crm.lead"|"comment"|"llamo y le pillo en reunión, queda en devolverme la llamada cuando termine "
"1058"|"SLeadsCom"|"2021-06-30 00:00:00"|"Diego Martín"|"SL014976"|"crm.lead"|"comment"|"Orona a través de la ingeniería IKOR quiere cambiar el display 4x20  ref.: PC2004LRU-CWB-BQ Ikor no nos ha comentado  que es para Orona, pero esta identificado Nos definen en detalle las especificaciones necesarias. "
"1059"|"SLeadsCom"|"2021-07-05 00:00:00"|"José Luis Trillo"|"SL014977"|"crm.lead"|"comment"|"Me comenta que necesitan del orden de las decenas, Le comento que hay MOQs de cientos-miles y me dice que no van a comprar tantas uds pq ellos no desarrollan producto, solo reparan. Al año consumen muy poco, tanto de pantallas como de sensores "
"1060"|"SLeadsCom"|"2021-06-29 00:00:00"|"José Luis Trillo"|"SL014978"|"crm.lead"|"comment"|"Sales lead de quectel. A raíz de la consulta de sysget nos ha contactado la empresa METRIS (son los mismos) para pedirnos oferta del kit de evaluación del bc92. actualmente están utilizando unos módulos 2g de cinterion para sus máquinas de vending. Sigo los comentarios en una tarea. "
"1061"|"SLeadsCom"|"2021-06-30 00:00:00"|"José Luis Trillo"|"SL014979"|"crm.lead"|"comment"|"Me llaman pidiendounas placas de recambio para los equipos AFL2-17A-H61 También nos pide un panel pc de 15"" con las siguientes características PANEL PC 15"" PCAP IP65 x2 usb + WIFI + cable de red "
"1062"|"SLeadsCom"|"2021-07-02 00:00:00"|"Carmen González"|"SL014980"|"crm.lead"|"comment"|"ENVIADO CATALOGO DE HARDWARE INDUSTRIAL Y VISUALIZACION "
"1063"|"SLeadsCom"|"2021-07-20 00:00:00"|"Iván Ruiz"|"SL014981"|"crm.lead"|"comment"|"Hablo con Carmelo, quedamos en reunirnos última semana de Julio Les interesa la parte de conectividad multioperador. "
"1064"|"SLeadsCom"|"2021-07-02 00:00:00"|"Carmen González"|"SL014982"|"crm.lead"|"comment"|"COOPERATIVA OLIVARERA. ESTAN PENSANDO EN MONITORIZAR LOS CULTIVOS. NO PUEDO ASISTIR AL WEBINAR. ME DICE QUE VA A MIRAR LA INFORMACIÓN, QUE LE DE 1 SEMANA "
"1065"|"SLeadsCom"|"2021-07-09 00:00:00"|"Carmen González"|"SL014982"|"crm.lead"|"comment"|"ME DICE QUE AHORA NO TIENE TIEMPO DE MIRARSE NADA. QUE LO DEJEMOS PARA SEPTIEMBRE. "
"1066"|"SLeadsCom"|"2021-07-12 00:00:00"|"Carmen González"|"SL014982"|"crm.lead"|"comment"|"APUNTO EN CALENDARIO "
"1067"|"SLeadsCom"|"2021-07-02 00:00:00"|"Carmen González"|"SL014983"|"crm.lead"|"comment"|"NO PUDO ASISTIR. ME DICE QUE LE DEJE VER LA GRABACION Y LE LLAME EL MIERCOLES "
"1068"|"SLeadsCom"|"2021-07-07 00:00:00"|"Carmen González"|"SL014983"|"crm.lead"|"comment"|"NO SE HA PODIDO MIRAR NADA. ME DICE QUE LE LLAME LA SEMANA QUE VIENE "
"1069"|"SLeadsCom"|"2021-07-15 00:00:00"|"Carmen González"|"SL014983"|"crm.lead"|"comment"|"SE GUARDA LA INFORMACION, LE PARECE INTERESANTE, DE MOMENTO NO TIENE NINGUN  PROYECTO. ME LLAMARA SI LE SALES ALGO "
"1070"|"SLeadsCom"|"2021-07-05 00:00:00"|"Carmen González"|"SL014984"|"crm.lead"|"comment"|"SALTA EL BUZON "
"1071"|"SLeadsCom"|"2021-07-07 00:00:00"|"Carmen González"|"SL014984"|"crm.lead"|"comment"|"No pudo asistir no se ha podido leer la información. Es un ingeniero agrario. No tiene ningún proyecto. Quería información para ofrecersela a sus clientes. ES EL MISMO QUE MACAM INGENIEROS "
"1072"|"SLeadsCom"|"2021-07-05 00:00:00"|"José Luis Trillo"|"SL014986"|"crm.lead"|"comment"|"La empresa es de madrid, pero los dos de valencia están teletrabajando ediaz@arquimea.com emiliano diaz Me comentan que todo se lleva desde madrid El contacto de Emiliano me lo dá Daznia. daznia.bompart@arquimea.com Me comenta que le enviemos email porque no tiene su movil "
"1073"|"SLeadsCom"|"2021-07-14 00:00:00"|"Iván Ruiz"|"SL014986"|"crm.lead"|"comment"|"Envío correo a Emiliano proponiendo un call de cara a valorar cómo podríamos encajar ambas empresas. Ya intenté por un par de ocasiones contactar con David sin éxito; no te facilitan el móvil y por correo no responden "
"1074"|"SLeadsCom"|"2021-07-06 00:00:00"|"Carmen González"|"SL014987"|"crm.lead"|"comment"|"SALTA EL BUZON "
"1075"|"SLeadsCom"|"2021-07-07 00:00:00"|"Carmen González"|"SL014987"|"crm.lead"|"comment"|"SALTA EL BUZON "
"1076"|"SLeadsCom"|"2021-07-09 00:00:00"|"Carmen González"|"SL014987"|"crm.lead"|"comment"|"SALTA EL BUZON "
"1077"|"SLeadsCom"|"2021-07-12 00:00:00"|"Carmen González"|"SL014987"|"crm.lead"|"comment"|"SALTA EL BUZON. "
"1078"|"SLeadsCom"|"2021-07-13 00:00:00"|"Carmen González"|"SL014987"|"crm.lead"|"comment"|"SALTA EL BUZON Es una asociacion de agricultores. Cierro sin posibilidad "
"1079"|"SLeadsCom"|"2021-07-06 00:00:00"|"Carmen González"|"SL014989"|"crm.lead"|"comment"|"Es el Técnico de una comunidad de regantes que están en los años 70 a nivel tecnológico. El intenta hacer una labor didáctica para que se modernicen. No pudo asistir al webinar y le envío la grabación. "
"1080"|"SLeadsCom"|"2021-07-05 00:00:00"|"José Luis Trillo"|"SL014990"|"crm.lead"|"comment"|"comunica "
"1081"|"SLeadsCom"|"2021-07-09 00:00:00"|"José Luis Trillo"|"SL014990"|"crm.lead"|"comment"|"iotera son partners suyos actualmente tiene instalaciones con 2G donde se le funde la bateria de los dispositivos rapidisimamente.  Le he explicado sobre lorawan y están interesados en implementar dispositivos de este tipo en el futuro, pero quieren que cada dispositivo se pueda geolocalizar porque en invernaderos se crean microclimas Enviar email con info de BNERGY y sensores milesight "
"1082"|"SLeadsCom"|"2021-07-19 00:00:00"|"José Luis Trillo"|"SL014990"|"crm.lead"|"comment"|"Esto es de Andalucía "
"1083"|"SLeadsCom"|"2021-07-20 00:00:00"|"Carmen González"|"SL014990"|"crm.lead"|"comment"|"Me dice que están terminando de configurar equips en GPRS pero que nos pongamos en contacto con ellos en septiempre porque van a empezar proyectos con Lorawan. Paso contacto a IVAN "
"1084"|"SLeadsCom"|"2021-07-14 00:00:00"|"Antonio Vacas"|"SL014992"|"crm.lead"|"comment"|"El cliente me ha comentado que no lo vio interesante, el no necesita equipos fabricados. "
"1085"|"SLeadsCom"|"2021-07-05 00:00:00"|"José Luis Trillo"|"SL014993"|"crm.lead"|"comment"|"Me pide que le mande un email con el link del webinar e info sobre sensores de milesight y bnergy un cliene suyo se plantea automatizar sus cultivos con sensores de humedad y también invernaderos con sensores de temperatura "
"1086"|"SLeadsCom"|"2021-07-21 00:00:00"|"José Luis Trillo"|"SL014993"|"crm.lead"|"comment"|"No me contestaba a mis emails. Le llamo y me dice que ya me dirá algo si sale el proyecto pero que no tiene previsiones hasta final de año como mínimo. "
"1087"|"SLeadsCom"|"2021-07-06 00:00:00"|"Carmen González"|"SL014994"|"crm.lead"|"comment"|"SALTA EL CONTESTADOR "
"1088"|"SLeadsCom"|"2021-07-07 00:00:00"|"Carmen González"|"SL014994"|"crm.lead"|"comment"|"SALTA EL CONTESTADOR "
"1089"|"SLeadsCom"|"2021-07-09 00:00:00"|"Carmen González"|"SL014994"|"crm.lead"|"comment"|"Es una ingeniera agrónoma que trabaja para una empresa francesa. Todo se lleva desde alli. VENTA MATERIAL AGRICOLA No tiene poder de decisión en las compras. No vió el webinar completo y me pide que se lo envíe "
"1090"|"SLeadsCom"|"2021-07-14 00:00:00"|"Carmen González"|"SL014996"|"crm.lead"|"comment"|"REPETIDO CON LEAD SL015035 "
"1091"|"SLeadsCom"|"2021-07-06 00:00:00"|"Carmen González"|"SL014997"|"crm.lead"|"comment"|"Vuelvo a enviar la presentación. Está con el proyecto fin de carrera trabajando con tema de comunicaciones "
"1092"|"SLeadsCom"|"2021-07-09 00:00:00"|"José Luis Trillo"|"SL014998"|"crm.lead"|"comment"|"comunica "
"1093"|"SLeadsCom"|"2021-07-15 00:00:00"|"José Luis Trillo"|"SL014998"|"crm.lead"|"comment"|"He llamado unas 4 veces y no me cogen el teléfono "
"1094"|"SLeadsCom"|"2021-07-19 00:00:00"|"José Luis Trillo"|"SL014998"|"crm.lead"|"comment"|"Estos son de andalucia y están asignados al banco este. De todas formas, solo hacen monitorización de cultivos con drones "
"1095"|"SLeadsCom"|"2021-07-09 00:00:00"|"José Luis Trillo"|"SL014999"|"crm.lead"|"comment"|"El número de telf no existe le envío email "
"1096"|"SLeadsCom"|"2021-07-15 00:00:00"|"José Luis Trillo"|"SL014999"|"crm.lead"|"comment"|"No recibo respuesta "
"1097"|"SLeadsCom"|"2021-07-06 00:00:00"|"Carmen González"|"SL015000"|"crm.lead"|"comment"|"No puedo asistir porque estaba trabajando. Solo asistió por formación. Le envío grabación del webinar. Dice que no trabaja en nada relacionado con esto "
"1098"|"SLeadsCom"|"2021-07-02 00:00:00"|"Carmen González"|"SL015001"|"crm.lead"|"comment"|"NO PUEDO LLAMARLE. FABRICAN UNA SOLUCION SIMILAR A LA NUESTRA. "
"1099"|"SLeadsCom"|"2021-07-06 00:00:00"|"Carmen González"|"SL015002"|"crm.lead"|"comment"|"TFONO ENCONTRADO EN INTERNET "
"1100"|"SLeadsCom"|"2021-07-07 00:00:00"|"Carmen González"|"SL015002"|"crm.lead"|"comment"|"Hablo con TEPRO Sevilla que es donde esta la central. Me dicen que enví email a Antonio Garcia. agarcia@tepro.es "
"1101"|"SLeadsCom"|"2021-07-09 00:00:00"|"Carmen González"|"SL015002"|"crm.lead"|"comment"|"LLamo a Antonio y me dicen que no me pueden pasar "
"1102"|"SLeadsCom"|"2021-07-13 00:00:00"|"Carmen González"|"SL015002"|"crm.lead"|"comment"|"Vuelvo a intentar hablar con Antonio y me dicen que me tengo que dirigir por mail, le comento que ya lo he ehcho y me vuelve a decir que no me puede pasar. Cierro sin posibilidad "
"1103"|"SLeadsCom"|"2021-07-07 00:00:00"|"Antonio Vacas"|"SL015005"|"crm.lead"|"comment"|"Comentarios en la actividad "
"1104"|"SLeadsCom"|"2021-07-06 00:00:00"|"Carmen González"|"SL015007"|"crm.lead"|"comment"|"NO SE PUEDE LOCALIZAR. ES UN GRUPO DE EMPRESAS Y ESTE TELEFONO (ENCONTRADO EN INTERNET) PERTENECE A UNA DE ELLAS ME TOMAN DATOS PARA QUE CUANDO LO LOCALICEN ME LLAME "
"1105"|"SLeadsCom"|"2021-07-09 00:00:00"|"Carmen González"|"SL015007"|"crm.lead"|"comment"|"COOPERATIVA "
"1106"|"SLeadsCom"|"2021-07-12 00:00:00"|"Carmen González"|"SL015007"|"crm.lead"|"comment"|"LO VUELVO A INTENTAR Y ME DICEN QUE NO ME PUEDEN PASAR CON NADIE. ME TOMAN NOTA "
"1107"|"SLeadsCom"|"2021-07-13 00:00:00"|"Carmen González"|"SL015007"|"crm.lead"|"comment"|"CIERRO SIN POSIBILIDAD "
"1108"|"SLeadsCom"|"2021-07-02 00:00:00"|"Carmen González"|"SL015008"|"crm.lead"|"comment"|"Llamada telefónica "
"1109"|"SLeadsCom"|"2021-07-02 00:00:00"|"Carmen González"|"SL015009"|"crm.lead"|"comment"|"No tiene ninguna explotación donde le hayan pedido monitorización Asistió al webinar por formación. Le pareció muy interesante para plantear a los clientes que lo necesiten. Me pregunta si hacemos mantnimiento de las instalaciones. Le digo que no. Que el mantenimiento es cambiar la pila del sensor, en algunos casos cada 3 años. En caso de que surja se pondrá en contacto con nosotros "
"1110"|"SLeadsCom"|"2021-07-14 00:00:00"|"Iván Ruiz"|"SL015011"|"crm.lead"|"comment"|"Llamada telefónica "
"1111"|"SLeadsCom"|"2021-07-02 00:00:00"|"Carmen González"|"SL015012"|"crm.lead"|"comment"|"NO RESPONDE AL TELEFONO "
"1112"|"SLeadsCom"|"2021-07-06 00:00:00"|"Carmen González"|"SL015012"|"crm.lead"|"comment"|"Fue para aprender. Quiere ver todas las tecnologías que se pueden aplicar en el campo. El webinar le gustó mucho pero ahora mismo no tiene proyectos. "
"1113"|"SLeadsCom"|"2021-07-13 00:00:00"|"Xavier Andiñach"|"SL015013"|"crm.lead"|"comment"|"SALES MAL LINKADO, DEBERÍA LINKARSE CON HMS INDUSTRIAL NETWORK INTESIS HA QUEDADO SOLO COMO MARCA COMERCIAL. IGUALMENTE CIERRO EL SALES PQ NO HAY POSIBILIDAD DE NEGOCIO "
"1114"|"SLeadsCom"|"2021-07-15 00:00:00"|"José Luis Trillo"|"SL015017"|"crm.lead"|"comment"|"No me lo cogía Me atiende hoy al teléfono y me dice que ahora no me puede atender "
"1115"|"SLeadsCom"|"2021-07-19 00:00:00"|"José Luis Trillo"|"SL015017"|"crm.lead"|"comment"|"Tienen algo parecido al BNERGY, el SENSE4LOCATION Proyectos IoT para ganadería y localizacion, pero comenta que la localización no es por GPS. Le comento sobre los sensores y me pregunta si nosotros tenemos soluciones integradas donde no se dependa de un servidor externo LoRA. Le comento sobre BNERGY y me dice que está interesado si es intregrable con su plataforma. Me pide catálogo y se lo envío. Aún así, ahora mismo no tiene proyectos, ya nos avisará si le sale algo. "
"1116"|"SLeadsCom"|"2021-07-29 00:00:00"|"Iván Ruiz"|"SL015018"|"crm.lead"|"comment"|"Ya contactando con Emiliano Diaz, de la división Arquimea Agrotech que se encuentran en Villalba. "
"1117"|"SLeadsCom"|"2021-09-02 00:00:00"|"Iván Ruiz"|"SL015018"|"crm.lead"|"comment"|"Me dicen que llame dentro  de una hora "
"1118"|"SLeadsCom"|"2021-09-07 00:00:00"|"Iván Ruiz"|"SL015018"|"crm.lead"|"comment"|"El teléfono no se encuentra disponible "
"1119"|"SLeadsCom"|"2021-07-02 00:00:00"|"Carmen González"|"SL015019"|"crm.lead"|"comment"|"REUNIDO LLAMAR LUNES "
"1120"|"SLeadsCom"|"2021-07-05 00:00:00"|"Carmen González"|"SL015019"|"crm.lead"|"comment"|"NO ESTA. LLAMAR MAÑANA "
"1121"|"SLeadsCom"|"2021-07-02 00:00:00"|"Carmen González"|"SL015020"|"crm.lead"|"comment"|"SALTA EL BUZON "
"1122"|"SLeadsCom"|"2021-07-06 00:00:00"|"Carmen González"|"SL015020"|"crm.lead"|"comment"|"SALTA EL BUZON "
"1123"|"SLeadsCom"|"2021-07-13 00:00:00"|"Carmen González"|"SL015020"|"crm.lead"|"comment"|"COMENTARIO EN SALE SL015023 "
"1124"|"SLeadsCom"|"2021-07-15 00:00:00"|"José Luis Trillo"|"SL015021"|"crm.lead"|"comment"|"Me comenta que no me puede atender ahora, que me llama más tarde Quiere oferta del starter Kit. No tienen proyectos pero quieren probar tecnología LoRaWAN para ver si puede ser interesante usar este tipo "
"1125"|"SLeadsCom"|"2021-07-16 00:00:00"|"José Luis Trillo"|"SL015021"|"crm.lead"|"comment"|"de producto "
"1126"|"SLeadsCom"|"2021-07-15 00:00:00"|"José Luis Trillo"|"SL015022"|"crm.lead"|"comment"|"No me coge el teléfono "
"1127"|"SLeadsCom"|"2021-07-07 00:00:00"|"Carmen González"|"SL015023"|"crm.lead"|"comment"|"SALTA CONTESTADOR DE REUNION. QUE LE LLAME MAÑANA "
"1128"|"SLeadsCom"|"2021-07-05 00:00:00"|"Jorge Cuadra"|"SL015024"|"crm.lead"|"comment"|"Llamada telefónica "
"1129"|"SLeadsCom"|"2021-07-20 00:00:00"|"Iván Ruiz"|"SL015025"|"crm.lead"|"comment"|"Tras hablar con Fran se descarta colaborar en los proyectos que proponen "
"1130"|"SLeadsCom"|"2021-07-02 00:00:00"|"Carmen González"|"SL015026"|"crm.lead"|"comment"|"Es el mismo que sales SL015008 "
"1131"|"SLeadsCom"|"2021-07-09 00:00:00"|"Renato Vila"|"SL015027"|"crm.lead"|"comment"|"Llamada telefónica "
"1132"|"SLeadsCom"|"2021-07-15 00:00:00"|"José Luis Trillo"|"SL015029"|"crm.lead"|"comment"|"Llamada telefónica "
"1133"|"SLeadsCom"|"2021-07-02 00:00:00"|"Carmen González"|"SL015030"|"crm.lead"|"comment"|"SON LOS MISMOS QUE ACTIVA. FABRICAN UNA SOLUCION SIMILAR A LA NUESTRA. "
"1134"|"SLeadsCom"|"2021-07-05 00:00:00"|"Abel Neila"|"SL015031"|"crm.lead"|"comment"|"Me comenta que no pudo hacer la foración, de todas maneras, de momento no tiene proyectos de este tipo así que cuando le salgan, podemos mirarlo. "
"1135"|"SLeadsCom"|"2021-07-05 00:00:00"|"Antonio Vacas"|"SL015033"|"crm.lead"|"comment"|"Llamada telefónica Comentarios en la actividad. "
"1136"|"SLeadsCom"|"2021-07-28 00:00:00"|"Iván Ruiz"|"SL015034"|"crm.lead"|"comment"|"Llamada telefónica "
"1137"|"SLeadsCom"|"2021-08-31 00:00:00"|"Iván Ruiz"|"SL015035"|"crm.lead"|"comment"|"Llamada telefónica "
"1138"|"SLeadsCom"|"2021-07-09 00:00:00"|"José Luis Trillo"|"SL015036"|"crm.lead"|"comment"|"Llamada telefónica "
"1139"|"SLeadsCom"|"2021-07-09 00:00:00"|"José Luis Trillo"|"SL015037"|"crm.lead"|"comment"|"Llamada telefónica "
"1140"|"SLeadsCom"|"2021-07-09 00:00:00"|"José Luis Trillo"|"SL015038"|"crm.lead"|"comment"|"Llamada telefónica "
"1141"|"SLeadsCom"|"2021-07-20 00:00:00"|"Daniel Rueda"|"SL015039"|"crm.lead"|"comment"|"Hablo con Gerard y me comenta que se dedican a las soluciones de visión artificial para el sector industrial. Le comento que podríamos buscar un hueco para poder hacerle una breve presentación, pero me comenta que están muy contentos con Omron y Datalogic (este último es quien les suministra los procesadores de visión). Y la verdad es que nos agradece la llamada pero no están interesados. "
"1142"|"SLeadsCom"|"2021-07-21 00:00:00"|"Daniel Rueda"|"SL015040"|"crm.lead"|"comment"|"Hablo con Xavier, ya que con Jorge no ha sido posible. Me comenta que están mas orientados a SW. Y que hacen de ingeniería claro, pero que recurren al HW en ocasiones cuando les es necesario. Le comento de hacer una presentación para conocernos y que conozcan Monolitic. Y si además de él, quiere estar la persona encargada del dept. técnico o de ingeniería, Pues estaría perfecto. Me comenta que le envíe un correo con mis datos de contacto y así poder darme contestación para cuando sería esa reunión. "
"1143"|"SLeadsCom"|"2021-07-20 00:00:00"|"Daniel Rueda"|"SL015041"|"crm.lead"|"comment"|"Hablo con Jordi y me comenta que al no decidir ellos nada con respecto al HW (lo definen los terceros), no hay ningún interés. Tampoco me facilita los contactos de esos terceros ya que es por temas de confidencialidad por el que no nos los dan. "
"1144"|"SLeadsCom"|"2021-07-20 00:00:00"|"Daniel Rueda"|"SL015042"|"crm.lead"|"comment"|"Hablo con Alex y me comenta que podríamos hacer colaboraciones con ellos. Alex no es el director de venta, ya que al proponerle una presentación me comenta que le parece bien ya que podríamos tener sinergias, pero que lo comenta con su responsable para reunirnos. Me confirmará si es esta semana que viene o es a principios de septiembre. "
"1145"|"SLeadsCom"|"2021-07-21 00:00:00"|"Daniel Rueda"|"SL015042"|"crm.lead"|"comment"|"Finalmente, dicha reunión será para Septiembre. "
"1146"|"SLeadsCom"|"2021-07-15 00:00:00"|"José Luis Trillo"|"SL015043"|"crm.lead"|"comment"|"No me cogen el teléfono Le he hecho una presentación de las líneas que llevamos. Están interesados en switches industriales. Me comenta que le pase email con los switches que llevamos y que lo valorará en enero de 2022 "
"1147"|"SLeadsCom"|"2021-07-16 00:00:00"|"José Luis Trillo"|"SL015043"|"crm.lead"|"comment"|"Le pregunto si se lo h mirado y me dice que se lo empieza a mirar sobre octubre, para tener decisión en enero. "
"1148"|"SLeadsCom"|"2021-07-21 00:00:00"|"Daniel Rueda"|"SL015044"|"crm.lead"|"comment"|"Hablo con Joan y me comenta que le envíe un catálogo porque no tiene tiempo para atenderme y si le interesa algo contactará con nosotros. Sabemos que cuando nos dice esto es que al no mostrar ningún tipo de interés el cliente no suele mirarse nada tras enviarselo. Pero lo llamaré en una semana para ver si ha podido y ver si hay interés. "
"1149"|"SLeadsCom"|"2021-07-30 00:00:00"|"Daniel Rueda"|"SL015044"|"crm.lead"|"comment"|"Tras hablar con Joan de nuevo para ver si ha podido mirar nuestro portfolio, me comenta que no ha podido pero que no hay interés, que se lo mirará cuando pueda y si en algún momento puede encajar algo, se guarda mi contacto para contactar conmigo. "
"1150"|"SLeadsCom"|"2021-07-15 00:00:00"|"José Luis Trillo"|"SL015045"|"crm.lead"|"comment"|"Lider en impresión 3D No me coge el teléfono, salta a su compañero y le deja nota "
"1151"|"SLeadsCom"|"2021-07-16 00:00:00"|"José Luis Trillo"|"SL015045"|"crm.lead"|"comment"|"Solo son distribuidores y nada más. No hay ningún tipo de sinergia. "
"1152"|"SLeadsCom"|"2021-07-02 00:00:00"|"José Luis Trillo"|"SL015046"|"crm.lead"|"comment"|"Datos de ALEX: Alex Regrettier - Mechanical Division Mgr aregrettier@robotnik.es "
"1153"|"SLeadsCom"|"2021-07-06 00:00:00"|"Carmen González"|"SL015048"|"crm.lead"|"comment"|"ENVIADA PRESENTACION "
"1154"|"SLeadsCom"|"2021-07-12 00:00:00"|"Carmen González"|"SL015048"|"crm.lead"|"comment"|"SU EMPRESA DISTRIBUYE PRODUCTOS DE AGRICULTURA. PIDIO EL PDF DEL WEBINAR POR FORMACION, NO TIENE NADA QUE VER CON SU TRABAJO "
"1155"|"SLeadsCom"|"2021-07-15 00:00:00"|"José Luis Trillo"|"SL015049"|"crm.lead"|"comment"|"Marta no está disponible "
"1156"|"SLeadsCom"|"2021-07-19 00:00:00"|"José Luis Trillo"|"SL015049"|"crm.lead"|"comment"|"No se puede poner al teléfono "
"1157"|"SLeadsCom"|"2021-07-20 00:00:00"|"José Luis Trillo"|"SL015049"|"crm.lead"|"comment"|"Me dicen que sigue reunida y que ella comenta que simplemente no se pudo inscribir cuando quiso hacerlo y solicitó el envío del webinar, pero que no solicitó ninguna llamada. Comenta que si queremos algo, se lo digamos por mail cuando le pasemos el video. "
"1158"|"SLeadsCom"|"2021-07-22 00:00:00"|"José Luis Trillo"|"SL015049"|"crm.lead"|"comment"|"No tenemos el email de Marta y no me lo dan en recepción Tampoco me pasan con ella por teléfono. Cierro el lead por falta de interés. "
"1159"|"SLeadsCom"|"2021-07-06 00:00:00"|"Carmen González"|"SL015050"|"crm.lead"|"comment"|"ENVIADA PRESENTACION "
"1160"|"SLeadsCom"|"2021-07-13 00:00:00"|"Carmen González"|"SL015050"|"crm.lead"|"comment"|"Es un perito agrónomo. Tiene fincas propias. No ha visto el webinar entero. Le parece interesante pero es un tema a largo plazo. Me dice que mirará el webinar tranquilamente y lo ofrecerá a sus clientes. Puede ser interesante a largo plazo pero ahora no va a desarrollar nada "
"1161"|"SLeadsCom"|"2021-07-15 00:00:00"|"José Luis Trillo"|"SL015052"|"crm.lead"|"comment"|"No me puede atender "
"1162"|"SLeadsCom"|"2021-07-19 00:00:00"|"José Luis Trillo"|"SL015052"|"crm.lead"|"comment"|"Me pide info sobre gateways LoRa, porque ellos se han hecho sus propias placas electronicas "
"1163"|"SLeadsCom"|"2021-07-23 00:00:00"|"José Luis Trillo"|"SL015052"|"crm.lead"|"comment"|"En la llamada de seguimiento de ayer, me comentó que no se lo ha podido mirar y que este proyecto es para finales de año. Probablemente no me responda hasta mediados de septiembre porque ahora no están de lleno en esto, solo mirando un poco de info sin previsiones anuales "
"1164"|"SLeadsCom"|"2021-07-15 00:00:00"|"José Luis Trillo"|"SL015053"|"crm.lead"|"comment"|"Me comenta que se lo mira después de verano, pero que por ahora no tiene gran interés. "
"1165"|"SLeadsCom"|"2021-07-16 00:00:00"|"José Luis Trillo"|"SL015055"|"crm.lead"|"comment"|"De momento no me responden a mi email "
"1166"|"SLeadsCom"|"2021-07-19 00:00:00"|"José Luis Trillo"|"SL015055"|"crm.lead"|"comment"|"Llamo y me dice que ya me contestaran al email si están interesados. "
